{
  "role": "reviewer",
  "scope": { "kind": "unit", "id": "envelope-frontends", "base": "5340ed18" },
  "findings": [
    {
      "id": "rev-0001",
      "file": "src/client/chat/toolRenderers.tsx",
      "line": 284,
      "blocking": false,
      "reason": "The code-snippet card no longer falls back to openModal('code-snippet-expand') and only shows its expand button when the host passes onOpen. Two host card sites never pass onOpen: the chat get-entities tool result (toolRenderers.tsx:284 `<Card key slug entity />`) and the release-diff card (components/release/EntityDiffCard.tsx:104). So code-snippet cards there lose the way into `code-snippet-expand` they had before (diagram and spreadsheet cards already lacked it there). The goal moves opening to the host, so the host should supply `openEntityHandler(type, slug, bridge)` at those sites, or the loss should be recorded as accepted. Without that, it is a quiet UX regression rather than a deliberate one.",
      "portion": "envelope-frontends/p1-l2-l5"
    },
    {
      "id": "rev-0002",
      "file": "src/client/entities/registry.tsx",
      "line": 67,
      "blocking": false,
      "reason": "Now that diagram registers through clientPluginHost.registerFrontendModule, nothing in the tree calls `registerEntity` or `legacyRegisterClientEntity` (core/plugin-host/legacy-adapter.ts). The `registry` map is write-only, yet `registerEntity` is still re-exported from entities/index.ts. That leaves a whole dead registration path that is kept alive only by a test. Also, the comment in src/client/xml-markup/tags/references/ElementList.render.test.ts:60 still says diagram/plugin 'calls `registerEntity` at module load', which is no longer true. Either remove the path or record it as debt.",
      "portion": "envelope-frontends/p3-l11-l12"
    }
  ],
  "deviations": []
}
