{"role":"reviewer","scope":{"kind":"unit","id":"U6-polaczenie-mcp-wobec-przebudowy","base":"2f9e630c4bcccab45c35cb5374e3f89a1377452a"},"findings":[{"id":"rev-0001","portion":"U6-polaczenie-mcp-wobec-przebudowy/p1-m12-m31","file":"src/server/mcp/http-mount.ts","line":106,"blocking":false,"reason":"`session.current` holds the last composed ExternalSurface whose handlers close over the ProjectContext live at the session's last request. After invalidation/detach an idle open session keeps the released (disposed, FDs closed) predecessor reachable — not GC-able — until its next request re-syncs or the 30-min idle reap. Pre-existing; the new header overclaims. Remedy: on release, drop session surfaces bound to the released context (lazily re-resolving stub). U7's per-cycle memory measurement should account for this."}],"deviations":[]}
