{
  "role": "reviewer",
  "scope": {
    "kind": "unit",
    "id": "u08-entity-write-tools",
    "base": "5bcf11072c811fa3e7f0569925e2105b6dd26632"
  },
  "findings": [
    {
      "id": "rev-0001",
      "file": "plugins/c4s-plugin-api-contracts/test/backend/endpoint-tools.test.ts",
      "line": 115,
      "blocking": false,
      "reason": "The link_dto/unlink_dto record texts and params (RECORD_PARAMS, RECORDS) and a local declaredParams() are a second copy of what tests/helpers/write-tool-records.ts already holds (WRITE_TOOL_RECORDS['endpoint-tools-link-dto'/'-unlink-dto'], expectToolMatchesWriteRecord). The stated reason in decisions.md ('plugin tests do not import root helpers') does not hold in this repo: plugin tests already import root code by relative path (plugins/c4s-plugin-ac/test/ref-rewrite.test.ts imports ../../../src/server/db/...). Two copies of the spec text drift independently; import the shared records/helper instead.",
      "portion": "u08-entity-write-tools/p1-l3"
    },
    {
      "id": "rev-0002",
      "file": "tests/helpers/write-tool-records.ts",
      "line": 966,
      "blocking": false,
      "reason": "expectToolMatchesWriteRecord is a line-for-line copy of expectToolMatchesRecord in tests/helpers/read-tool-records.ts, differing only in the record table it looks up. Parametrize the existing helper by table (or export a generic matcher) rather than keep two implementations of the same contract check.",
      "portion": "u08-entity-write-tools/p1-l3"
    }
  ],
  "deviations": [
    "dev-2603"
  ]
}