{"role":"reviewer","scope":{"kind":"unit","id":"m05-polityka","base":"f5f982cdbeaa47d496c432e09998e53e3f454a44"},"findings":[{"id":"rev-0001","file":"src/server/routes/chat.resume-lock.test.ts","line":356,"blocking":false,"reason":"The new 'empty message with annotations' describe copies the file's existing `app()` deps/router factory (line 81) almost line for line. The only difference is that `getInitialArchitectureConfig` returns null here and `snapshot` there. A shared module-level factory that takes the thread and snapshot as parameters would remove the duplicate, so the two copies of the POST /chat deps stub cannot drift apart when the route gains a new dependency.","portion":"m05-polityka/p1-domain-l17"}],"deviations":[]}
