{"role":"reviewer","scope":{"kind":"unit","id":"u1-git-fetch-and-status","base":"d23236045f2aa0b09e37ccc75c512446067c4429"},"findings":[{"id":"rev-0001","file":"src/server/services/git.ts","line":197,"blocking":false,"reason":"gitNetwork() always sets GIT_SSH_COMMAND (fallback 'ssh'), overriding a user's GIT_SSH (plink/wrapper), and appends '-o BatchMode=yes' to any configured command a wrapper may not accept. Fix: leave GIT_SSH_COMMAND unset when GIT_SSH is set, or only add the flag when the resolved command is ssh.","portion":"u1-git-fetch-and-status/p1-l4-l4"},{"id":"rev-0002","file":"src/server/services/git.ts","line":1322,"blocking":false,"reason":"lastFetchedAt() is not gated on config.git.enabled while statusAheadBehind()/fetch() are; with git disabled /api/git/status returns ahead/behind null but a real lastFetchedAt.","portion":"u1-git-fetch-and-status/p1-l4-l4"},{"id":"rev-0003","file":"src/server/services/git.ts","line":443,"blocking":false,"reason":"commit() emits git:status-changed only on 'committed'; when the commit lands but switchAfterCommit fails (status 'error'), refs moved but no event — sidebar badge stale until focus refetch.","portion":"u1-git-fetch-and-status/p1-l4-l4"},{"id":"rev-0004","file":"src/server/services/git.ts","line":225,"blocking":false,"reason":"Repo lock keyed by --show-toplevel (worktree root), not the repository; linked worktrees of one repo get separate locks. Key by absolute --git-common-dir to match 'one lock per repository'.","portion":"u1-git-fetch-and-status/p1-l4-l4"}],"deviations":[]}
