{"role":"reviewer","scope":{"kind":"unit","id":"u5-m10-list-plans-order","base":"4ca15c78"},"findings":[{"id":"rev-0001","file":"src/server/routes/artifacts.ts","line":243,"blocking":false,"reason":"The plan adapter's opt-in limit/offset window copies the brief adapter's block at lines 110-115 line for line; a small local helper (e.g. windowWhenAsked(rows, query)) next to parsePaging would keep the two list renderings from drifting apart. No behaviour change.","portion":"u5-m10-list-plans-order/p1-l3-l4"}],"deviations":["dev-2701"]}
