{
  "role": "reviewer",
  "scope": {
    "kind": "unit",
    "id": "u13-plan-tools",
    "base": "df6687cc8950273a5482f2cf23636e1d54d906d4"
  },
  "findings": [
    {
      "id": "rev-0001",
      "file": "src/server/operations/core-operations.ts",
      "line": 1406,
      "blocking": false,
      "reason": "The diff aligns the `get_plan_version` row's `version` with its rendering (`int()` without `.positive()`). The `get_plan` row's `range` was not aligned the same way and still declares `{ start: int().positive(), end: int().positive() }`. plan-tools.ts now drops those bounds on purpose, so that a bad window reaches `applyArtifactRange` and answers INVALID_ARGUMENT. The two `get_plan` rows now disagree on the input shape, so a reader of the row is told the schema rejects a non-integer or a start below 1, but the rendering lets it through and the operation answers with the code. That is the same mismatch u12 rev-0002 raised for `get_brief`. Relax the row's `range` like its rendering, or comment why they differ.",
      "portion": "u13-plan-tools/p1-l3"
    }
  ],
  "deviations": []
}
