{"role":"reviewer","scope":{"kind":"unit","id":"U2-indeksacja-oddajaca-petle","base":"dea70f179763f9cf04b65005151b6c328f6dde62"},"findings":[{"id":"rev-0001","file":"src/server/services/entity-indexer.ts","line":259,"blocking":false,"reason":"Only the read/parse half of indexAll() is sliced; the commit still runs as one synchronous transaction proportional to project size. Pending the spec answer to dev-0002; becomes blocking if the writes must yield too.","portion":"U2-indeksacja-oddajaca-petle/p1-l7-l10"},{"id":"rev-0002","file":"src/server/services/entity-indexer.ts","line":243,"blocking":false,"reason":"indexAll() can now interleave with itself (overlapping projection rebuild) and with context teardown (db closed between slices). Consider serialising indexAll() calls (reuse the in-flight promise) and ending early when the context is disposed.","portion":"U2-indeksacja-oddajaca-petle/p1-l7-l10"}],"deviations":["dev-0002"]}
