{"role":"reviewer","scope":{"kind":"unit","id":"ctx-transagent-mount","base":"ef28a81d"},"findings":[{"id":"rev-0001","file":"src/server/services/transagent-dispatcher.ts","line":4,"blocking":false,"reason":"Stale header comment: 'A chat/patch thread delegates a unit of work…' — after this diff only a top-level chat thread mounts transagent-tools (the diff updated the equivalent comment in transagent-tools.ts and core-operations.ts but left this one). Reword to 'A top-level chat thread…'.","portion":"ctx-transagent-mount/p1-l15-l15"}],"deviations":["dev-0001"]}
