{"role":"reviewer","scope":{"kind":"unit","id":"m54-settings-ui","base":"5060e80d4560cf4c7e692b4a3fb84fa8d9f5fc5e"},"findings":[{"id":"rev-0001","file":"src/client/ui/events.ts","line":107,"blocking":false,"reason":"ConfirmKind runner-host-remove comment says payload { id } but the call site passes none.","portion":"m54-settings-ui/p1-l5-l17"},{"id":"rev-0002","file":"src/client/components/runner-hosts/RunnerHostDialog.tsx","line":133,"blocking":false,"reason":"Dialog onClose stays active while a save is pending; cancelling mid-request skips refresh() and the toast.","portion":"m54-settings-ui/p1-l5-l17"}],"deviations":[]}
